[
  {
    "hallmark_id": "genomic_instability",
    "overview": "June first-pass summaries and the transposon update make the human relevance and claim boundaries clearer, but genomic instability still reads more like enabling biology than a mature intervention program.",
    "next_stage_requirement": "Controlled human evidence that genome-maintenance, retrotransposon, or somatic-mutation interventions hit their intended target or improve function.",
    "key_question": "Can tractable genome-maintenance interventions move human aging-relevant outcomes without unacceptable safety, mutation, or inflammation tradeoffs?",
    "last_reviewed": "2026-06-06",
    "review_reason": "June 2026 editorial rollup after the transposon and somatic mutation control missing-context publication added RTI biomarker and trial context, TPN-101 activity, DREAM biology, and TET2 CHIP boundaries without changing forecast status.",
    "related_outlook_ids": [
      "hallmark-genomic-instability-outlook",
      "track-dna-repair-enhancement-outlook",
      "track-genome-surveillance-and-chromosome-stability-outlook",
      "track-transposon-and-somatic-mutation-control-outlook"
    ],
    "related_publication_event_ids": [
      "publish-dna-repair-enhancement-bootstrap-2026-05-31-2026-05-31t14-32-18-294z",
      "publish-genome-surveillance-and-chromosome-stability-bootstrap-2026-05-31-2026-05-31t20-14-53-931z",
      "publish-transposon-and-somatic-mutation-control-bootstrap-2026-06-01-2026-06-02t00-31-27-696z",
      "publish-transposon-and-somatic-mutation-control-coverage-repair-2026-06-06-2026-06-06t12-22-33-769z"
    ]
  },
  {
    "hallmark_id": "telomere_attrition",
    "overview": "Telomerase now has a human biomarker foothold, while telomere protection and capping remain animal-stage and safety-sensitive.",
    "next_stage_requirement": "Human biomarker or function data from clearly targeted telomere programs.",
    "key_question": "Can telomere-focused benefit be delivered without simply moving risk elsewhere?",
    "last_reviewed": "2026-06-04",
    "review_reason": "June 2026 editorial rollup after reviewed telomere restoration and protection baselines.",
    "related_outlook_ids": [
      "hallmark-telomere-attrition-outlook",
      "track-telomerase-restoration-outlook",
      "track-telomere-protection-and-capping-outlook"
    ],
    "related_publication_event_ids": [
      "publish-telomerase-restoration-bootstrap-2026-05-31-2026-05-31t15-14-40-874z",
      "publish-telomere-protection-and-capping-bootstrap-2026-05-31-2026-05-31t21-55-18-580z"
    ]
  },
  {
    "hallmark_id": "epigenetic_alterations",
    "overview": "Partial reprogramming still drives attention, while methylation and chromatin tracks keep the human-use story mixed and early.",
    "next_stage_requirement": "Safe human programs that go beyond clocks and short-term signatures.",
    "key_question": "Will epigenetic restoration stay measurable when the endpoint becomes actual human function?",
    "last_reviewed": "2026-06-04",
    "review_reason": "June 2026 editorial rollup after reviewed epigenetic restoration and chromatin baselines.",
    "related_outlook_ids": [
      "hallmark-epigenetic-alterations-outlook",
      "track-partial-reprogramming-outlook",
      "track-dna-methylation-and-epigenome-restoration-outlook",
      "track-chromatin-and-histone-modulation-outlook"
    ],
    "related_publication_event_ids": [
      "publish-partial-reprogramming-update-2026-05-29-2026-05-31t13-30-12-515z",
      "publish-dna-methylation-and-epigenome-restoration-bootstrap-2026-05-31-2026-06-01t00-02-21-706z",
      "publish-chromatin-and-histone-modulation-bootstrap-2026-06-02-2026-06-02t11-35-30-622z"
    ]
  },
  {
    "hallmark_id": "loss_of_proteostasis",
    "overview": "The hallmark now spans animal proteasome work, disease-specific chaperone signals, and protein-aggregate programs with real clinical endpoints.",
    "next_stage_requirement": "Human programs with interpretable aging-relevant functional endpoints.",
    "key_question": "Can proteostasis support become a generalized aging intervention rather than a disease-specific tool?",
    "last_reviewed": "2026-06-04",
    "review_reason": "June 2026 editorial rollup after reviewed proteostasis track baselines.",
    "related_outlook_ids": [
      "hallmark-loss-of-proteostasis-outlook",
      "track-chaperone-and-heat-shock-support-outlook",
      "track-proteasome-enhancement-outlook",
      "track-protein-aggregate-clearance-outlook"
    ],
    "related_publication_event_ids": [
      "publish-chaperone-and-heat-shock-support-bootstrap-2026-05-31-2026-05-31t15-44-20-234z",
      "publish-proteasome-enhancement-bootstrap-2026-06-01-2026-06-01t10-27-12-753z",
      "publish-protein-aggregate-clearance-bootstrap-2026-06-02-2026-06-02t12-29-42-280z"
    ]
  },
  {
    "hallmark_id": "disabled_macroautophagy",
    "overview": "Multiple autophagy-linked tracks now have signals near human evidence, but target changes still outrun long-lasting outcome evidence.",
    "next_stage_requirement": "Repeated human evidence that autophagy target changes predict long-lasting benefit.",
    "key_question": "When does changing an autophagy target stop being merely interesting and start being enough?",
    "last_reviewed": "2026-06-04",
    "review_reason": "June 2026 editorial rollup after reviewed autophagy, lysosomal, and selective-autophagy baselines.",
    "related_outlook_ids": [
      "hallmark-disabled-macroautophagy-outlook",
      "track-autophagy-induction-outlook",
      "track-lysosomal-restoration-outlook",
      "track-selective-autophagy-and-organelle-quality-control-outlook"
    ],
    "related_publication_event_ids": [
      "publish-autophagy-induction-track-scan-2026-05-30-2026-05-31t11-01-02-701z",
      "publish-lysosomal-restoration-bootstrap-2026-06-01-2026-06-01t11-24-31-086z",
      "publish-selective-autophagy-and-organelle-quality-control-bootstrap-2026-06-02-2026-06-02t14-33-46-625z"
    ]
  },
  {
    "hallmark_id": "deregulated_nutrient_sensing",
    "overview": "This remains one of the most operationally mature hallmark areas, now with rapalog, AMPK, caloric-restriction-mimetic, and insulin/IGF baselines in view.",
    "next_stage_requirement": "Replicated human functional outcomes in older adults, not just pathway or biomarker movement.",
    "key_question": "Can the field turn mature biology into strong everyday gains in how people function?",
    "last_reviewed": "2026-06-04",
    "review_reason": "June 2026 editorial rollup after reviewed nutrient-sensing track baselines.",
    "related_outlook_ids": [
      "hallmark-deregulated-nutrient-sensing-outlook",
      "track-rapalogs-outlook",
      "track-ampk-and-metabolic-modulators-outlook",
      "track-caloric-restriction-mimetics-outlook",
      "track-insulin-igf-axis-modulation-outlook"
    ],
    "related_publication_event_ids": [
      "publish-ampk-and-metabolic-modulators-bootstrap-2026-06-01-2026-06-01t13-01-41-273z",
      "publish-caloric-restriction-mimetics-bootstrap-2026-06-02-2026-06-02t16-58-47-625z",
      "publish-insulin-igf-axis-modulation-bootstrap-2026-06-03-2026-06-03t10-23-40-450z"
    ]
  },
  {
    "hallmark_id": "mitochondrial_dysfunction",
    "overview": "The hallmark has several human functional or biomarker footholds, but delivery and transplantation remain animal-led and long-lasting outcomes are inconsistent.",
    "next_stage_requirement": "More long-lasting human function evidence tied to specific mitochondrial programs.",
    "key_question": "Which mitochondrial signals actually predict healthy-lifespan gain?",
    "last_reviewed": "2026-06-04",
    "review_reason": "June 2026 editorial rollup after reviewed mitochondrial track baselines and missing-context update.",
    "related_outlook_ids": [
      "hallmark-mitochondrial-dysfunction-outlook",
      "track-nad-and-redox-restoration-outlook",
      "track-mitophagy-enhancers-outlook",
      "track-mitochondrial-biogenesis-and-dynamics-outlook",
      "track-mitochondrial-delivery-and-transplantation-outlook"
    ],
    "related_publication_event_ids": [
      "publish-nad-and-redox-restoration-bootstrap-2026-05-31-2026-05-31t19-16-08-034z",
      "publish-mitochondrial-biogenesis-and-dynamics-bootstrap-2026-06-02-2026-06-02t19-00-55-783z",
      "publish-mitochondrial-delivery-and-transplantation-bootstrap-2026-06-03-2026-06-03t12-03-58-481z",
      "publish-mitochondrial-delivery-and-transplantation-coverage-repair-2026-06-03-2026-06-03t21-32-56-692z"
    ]
  },
  {
    "hallmark_id": "cellular_senescence",
    "overview": "Senolytics and senomorphics keep the clearest early human story, while immune clearance remains earlier and more platform-like.",
    "next_stage_requirement": "Independent human studies showing that people function better, with acceptable safety.",
    "key_question": "Does clearing or modulating senescent cells move meaningful human outcomes enough to matter?",
    "last_reviewed": "2026-06-04",
    "review_reason": "June 2026 editorial rollup after reviewed senomorphic and immune-clearance baselines.",
    "related_outlook_ids": [
      "hallmark-cellular-senescence-outlook",
      "track-senolytics-outlook",
      "track-senomorphics-outlook",
      "track-immune-clearance-of-senescent-cells-outlook"
    ],
    "related_publication_event_ids": [
      "publish-senomorphics-bootstrap-2026-06-01-2026-06-01t16-26-47-676z",
      "publish-immune-clearance-of-senescent-cells-bootstrap-2026-06-02-2026-06-02t19-01-04-272z"
    ]
  },
  {
    "hallmark_id": "stem_cell_exhaustion",
    "overview": "Replacement and transplantation now strengthen the functional case, but rejuvenation and niche-support evidence still does not generalize cleanly.",
    "next_stage_requirement": "Aging-relevant human endpoints that are not just narrow disease repair stories.",